{
  "$schema": "https://open-design.ai/schemas/plugin.v1.json",
  "name": "example-frame-macos-notification",
  "title": "macOS 通知横幅",
  "version": "0.1.0",
  "description": "拟真 macOS 通知 banner + app icon + 标题正文, 适合 video overlay / 产品发布预告",
  "license": "MIT",
  "author": {
    "name": "Open Design",
    "url": "https://github.com/nexu-io"
  },
  "homepage": "https://github.com/nexu-io/open-design/tree/main/plugins/_official/examples/frame-macos-notification",
  "tags": [
    "example",
    "first-party",
    "video",
    "macos",
    "notification",
    "banner",
    "overlay",
    "frame"
  ],
  "compat": {
    "agentSkills": [
      {
        "path": "./SKILL.md"
      }
    ]
  },
  "od": {
    "kind": "scenario",
    "taskKind": "new-generation",
    "mode": "video",
    "scenario": "video",
    "surface": "video",
    "featured": 41,
    "preview": {
      "type": "html",
      "entry": "./example.html"
    },
    "useCase": {
      "query": "用「macOS 通知横幅」模板把我的内容做成一段「拟真 macOS 通知 banner + app icon + 标题正文, 适合 video overlay / 产品发布预告」。保持模板的视觉签名，使用真实内容和数据，避免 lorem ipsum 和占位图片。",
      "exampleOutputs": [
        {
          "path": "./example.html",
          "title": "macOS 通知横幅"
        }
      ]
    },
    "context": {
      "skills": [
        {
          "path": "./SKILL.md"
        }
      ],
      "assets": [
        "./example.html"
      ]
    },
    "pipeline": {
      "stages": [
        {
          "id": "generate",
          "atoms": [
            "file-write",
            "live-artifact"
          ]
        }
      ]
    },
    "capabilities": [
      "prompt:inject",
      "fs:write"
    ]
  }
}
