{
  "$schema": "https://open-design.ai/schemas/plugin.v1.json",
  "name": "example-article-magazine",
  "title": "杂志文章",
  "version": "0.1.0",
  "description": "Huashu / huashu-md-html-inspired magazine article layout for turning Markdown or notes into a polished long-form HTML essay.",
  "license": "MIT",
  "author": {
    "name": "Open Design",
    "url": "https://github.com/nexu-io"
  },
  "homepage": "https://github.com/nexu-io/open-design/tree/main/plugins/_official/examples/article-magazine",
  "tags": [
    "example",
    "first-party",
    "prototype",
    "marketing",
    "web",
    "desktop",
    "blog",
    "essay",
    "newsletter",
    "untitled"
  ],
  "compat": {
    "agentSkills": [
      {
        "path": "./SKILL.md"
      }
    ]
  },
  "od": {
    "kind": "scenario",
    "taskKind": "new-generation",
    "mode": "prototype",
    "platform": "desktop",
    "scenario": "marketing",
    "surface": "web",
    "featured": 0.03,
    "preview": {
      "type": "html",
      "entry": "./example.html"
    },
    "useCase": {
      "query": "用「杂志文章」模板把我的内容做成一份「Huashu / huashu-md-html-inspired magazine article layout for turning Markdown or notes into a polished long-form HTML essay」。保持模板的视觉签名，使用真实内容和数据，避免 lorem ipsum 和占位图片。",
      "exampleOutputs": [
        {
          "path": "./example.html",
          "title": "杂志文章"
        }
      ]
    },
    "context": {
      "skills": [
        {
          "path": "./SKILL.md"
        }
      ],
      "assets": [
        "./example.html"
      ]
    },
    "pipeline": {
      "stages": [
        {
          "id": "generate",
          "atoms": [
            "file-write",
            "live-artifact"
          ]
        }
      ]
    },
    "capabilities": [
      "prompt:inject",
      "fs:write"
    ]
  }
}
