{
  "$schema": "https://open-design.ai/schemas/plugin.v1.json",
  "name": "video-template-sequence-and-movement-instruction-for-martial-arts-video",
  "title": "Sequence and Movement Instruction for Martial Arts Video",
  "version": "0.1.0",
  "description": "A video prompt for Seedance 2.0 that instructs the model to animate a sequence based on a character sheet, focusing on specific movements and steps.",
  "license": "CC-BY-4.0",
  "author": {
    "name": "Aijaz",
    "url": "https://x.com/iamsofiaijaz/status/2049045776001564680"
  },
  "homepage": "https://github.com/YouMind-OpenLab/awesome-seedance-2-prompts",
  "tags": [
    "video-template",
    "first-party",
    "video",
    "general",
    "fantasy",
    "3d-render"
  ],
  "od": {
    "kind": "scenario",
    "taskKind": "new-generation",
    "mode": "video",
    "scenario": "video",
    "surface": "video",
    "preview": {
      "type": "video",
      "poster": "https://pbs.twimg.com/media/HG-sP7Lb0AEmlWA.jpg"
    },
    "useCase": {
      "query": {
        "en": "[STYLE] Monochrome grayscale illustration, 3D-rendered character, clean instructional reference sheet, white background, comic-style cell grid layout, technical diagram aesthetic. [LAYOUT] 4×4 grid layout with a total of 16 panels. Each panel is separated by thin black border lines. Cells are numbered from 1 to 16, with consistent panel sizes. [CHARACTER] image1 (the same character appears consistently in all panels) [PANEL STRUCTURE – per cell] Top-left: bold number badge + English title text Center: full-body character pose illustration Bottom-left: English description text (3–4 lines) Overlay: directional arrows indicating movement [ARROWS / MOTION INDICATORS] Curved arrows, straight arrows, and circular rotation indicators placed around the character to show motion flow and direction. [RENDERING STYLE] Highly detailed 3D sculpted style, soft studio lighting, subtle shadows, no color, grayscale shading, clean linework, game concept art quality. [NEGATIVE] No background scenery, no color tones, no additional characters, no complex background. Create img2 that follows the exact sequence and movements from steps 1–16 shown in img1. The music should be aud1. There should be no dialogue, text, or narration.",
        "zh-CN": "使用这个插件完成以下任务：[STYLE] Monochrome grayscale illustration, 3D-rendered character, clean instructional reference sheet, white background, comic-style cell grid layout, technical diagram aesthetic. [LAYOUT] 4×4 grid layout with a total of 16 panels. Each panel is separated by thin black border lines. Cells are numbered from 1 to 16, with consistent panel sizes. [CHARACTER] image1 (the same character appears consistently in all panels) [PANEL STRUCTURE – per cell] Top-left: bold number badge + English title text Center: full-body character pose illustration Bottom-left: English description text (3–4 lines) Overlay: directional arrows indicating movement [ARROWS / MOTION INDICATORS] Curved arrows, straight arrows, and circular rotation indicators placed around the character to show motion flow and direction. [RENDERING STYLE] Highly detailed 3D sculpted style, soft studio lighting, subtle shadows, no color, grayscale shading, clean linework, game concept art quality. [NEGATIVE] No background scenery, no color tones, no additional characters, no complex background. Create img2 that follows the exact sequence and movements from steps 1–16 shown in img1. The music should be aud1. There should be no dialogue, text, or narration."
      }
    },
    "inputs": [
      {
        "name": "model",
        "label": "Model",
        "type": "select",
        "options": [
          "seedance-2.0"
        ],
        "default": "seedance-2.0"
      },
      {
        "name": "aspect",
        "label": "Aspect ratio",
        "type": "select",
        "options": [
          "16:9",
          "9:16",
          "1:1",
          "4:5"
        ],
        "default": "16:9"
      }
    ],
    "context": {
      "assets": [
        "./template.json"
      ]
    },
    "pipeline": {
      "stages": [
        {
          "id": "generate",
          "atoms": [
            "video-generate"
          ]
        }
      ]
    },
    "capabilities": [
      "prompt:inject",
      "media:video-generate"
    ]
  }
}
