{
  "$schema": "https://open-design.ai/schemas/plugin.v1.json",
  "name": "example-saas-landing",
  "title": "Saas Landing",
  "version": "0.1.0",
  "description": "Single-page SaaS landing with hero, features, social proof, pricing, and CTA.\nRespects the active DESIGN.md color/typography/layout tokens.\nTrigger keywords: \"saas landing\", \"marketing page\", \"product landing\".",
  "license": "MIT",
  "author": {
    "name": "Open Design",
    "url": "https://github.com/nexu-io"
  },
  "homepage": "https://github.com/nexu-io/open-design/tree/main/plugins/_official/examples/saas-landing",
  "tags": [
    "example",
    "first-party",
    "prototype",
    "marketing",
    "web",
    "desktop",
    "saas-landing",
    "marketing-page",
    "product-landing"
  ],
  "compat": {
    "agentSkills": [
      {
        "path": "./SKILL.md"
      }
    ]
  },
  "od": {
    "kind": "scenario",
    "taskKind": "new-generation",
    "mode": "prototype",
    "platform": "desktop",
    "scenario": "marketing",
    "surface": "web",
    "preview": {
      "type": "html",
      "entry": "./example.html"
    },
    "useCase": {
      "query": {
        "en": "Single-page SaaS landing with hero, features, social proof, pricing, and CTA. Respects the active DESIGN.md color/typography/layout tokens. Trigger keywords: \"saas landing\", \"marketing page\", \"product landing\".",
        "zh-CN": "使用这个插件完成以下任务：Single-page SaaS landing with hero, features, social proof, pricing, and CTA. Respects the active DESIGN.md color/typography/layout tokens. Trigger keywords: \"saas landing\", \"marketing page\", \"product landing\"."
      },
      "exampleOutputs": [
        {
          "path": "./example.html",
          "title": "Saas Landing"
        }
      ]
    },
    "inputs": [
      {
        "name": "product_name",
        "type": "string",
        "required": true
      },
      {
        "name": "tagline",
        "type": "string",
        "required": true
      },
      {
        "name": "has_pricing",
        "type": "boolean",
        "default": true
      },
      {
        "name": "proof_count",
        "type": "number",
        "default": 3,
        "min": 0,
        "max": 6
      }
    ],
    "context": {
      "skills": [
        {
          "path": "./SKILL.md"
        }
      ],
      "designSystem": {
        "primary": true
      },
      "craft": [
        "typography",
        "color",
        "anti-ai-slop",
        "laws-of-ux"
      ],
      "assets": [
        "./example.html"
      ]
    },
    "pipeline": {
      "stages": [
        {
          "id": "generate",
          "atoms": [
            "file-write",
            "live-artifact"
          ]
        }
      ]
    },
    "capabilities": [
      "prompt:inject",
      "fs:write"
    ]
  }
}
