{
  "$schema": "https://open-design.ai/schemas/plugin.v1.json",
  "name": "video-template-3d-animated-boy-building-lego",
  "title": "3D Animated Boy Building Lego",
  "version": "0.1.0",
  "description": "A multi-shot video prompt in 3D animation style describing a boy carefully assembling Lego pieces in a room, featuring time-lapse effects.",
  "license": "CC-BY-4.0",
  "author": {
    "name": "Alex Zhang",
    "url": "https://x.com/jojogh_007/status/2049123558102810714"
  },
  "homepage": "https://github.com/YouMind-OpenLab/awesome-seedance-2-prompts",
  "tags": [
    "video-template",
    "first-party",
    "video",
    "general"
  ],
  "od": {
    "kind": "scenario",
    "taskKind": "new-generation",
    "mode": "video",
    "scenario": "video",
    "surface": "video",
    "preview": {
      "type": "video",
      "poster": "https://customer-qs6wnyfuv0gcybzj.cloudflarestream.com/2dba80d5da706c3ea078ed69096c67d3/thumbnails/thumbnail.jpg",
      "video": "https://customer-qs6wnyfuv0gcybzj.cloudflarestream.com/2dba80d5da706c3ea078ed69096c67d3/downloads/default.mp4"
    },
    "useCase": {
      "query": {
        "en": "Scene: A boy in a room seriously assembling Lego blocks. The visual style is 3D animation with vibrant colors, smooth lines, full of childlike fun and vitality. A time-lapse effect is added to show the assembly process.\nScene: Wide shot of the room, sunlight spilling onto the desk through the window. The boy sits at the desk focused on assembling Lego, with a serious expression. The camera slowly zooms in.\nScene: Time-lapse effect showing the boy quickly snapping Lego pieces together, the blocks gradually taking shape in his hands. The camera switches to different angles.\nScene: Close-up of hands, showing details of the boy skillfully assembling Lego, fingers moving nimbly. The camera follows the hand movements.\nScene: Time-lapse effect continues showing the assembly process. The Lego creation becomes complete, and the boy's expression changes from focused to satisfied.\nScene: The boy looks up with a satisfied smile. The camera pulls back to reveal the finished Lego masterpiece.\n\nDuration: 00:20",
        "zh-CN": "使用这个插件完成以下任务：Scene: A boy in a room seriously assembling Lego blocks. The visual style is 3D animation with vibrant colors, smooth lines, full of childlike fun and vitality. A time-lapse effect is added to show the assembly process.\nScene: Wide shot of the room, sunlight spilling onto the desk through the window. The boy sits at the desk focused on assembling Lego, with a serious expression. The camera slowly zooms in.\nScene: Time-lapse effect showing the boy quickly snapping Lego pieces together, the blocks gradually taking shape in his hands. The camera switches to different angles.\nScene: Close-up of hands, showing details of the boy skillfully assembling Lego, fingers moving nimbly. The camera follows the hand movements.\nScene: Time-lapse effect continues showing the assembly process. The Lego creation becomes complete, and the boy's expression changes from focused to satisfied.\nScene: The boy looks up with a satisfied smile. The camera pulls back to reveal the finished Lego masterpiece.\n\nDuration: 00:20"
      }
    },
    "inputs": [
      {
        "name": "model",
        "label": "Model",
        "type": "select",
        "options": [
          "seedance-2.0"
        ],
        "default": "seedance-2.0"
      },
      {
        "name": "aspect",
        "label": "Aspect ratio",
        "type": "select",
        "options": [
          "16:9",
          "9:16",
          "1:1",
          "4:5"
        ],
        "default": "16:9"
      }
    ],
    "context": {
      "assets": [
        "./template.json"
      ]
    },
    "pipeline": {
      "stages": [
        {
          "id": "generate",
          "atoms": [
            "video-generate"
          ]
        }
      ]
    },
    "capabilities": [
      "prompt:inject",
      "media:video-generate"
    ]
  }
}
