{
  "$schema": "https://open-design.ai/schemas/plugin.v1.json",
  "name": "example-html-ppt-presenter-mode-reveal",
  "title": "Html Ppt Presenter Mode Reveal",
  "version": "0.1.0",
  "description": "演讲者模式专用 deck — tokyo-night 默认主题，5 套主题 T 键切换，每页带 150-300 字逐字稿示例（<aside class=\"notes\">），按 S 打开 popup（CURRENT / NEXT / SCRIPT / TIMER 四张磁吸卡片）。用于技术分享、公开演讲、课程讲解，怕忘词或要提词器的场景。",
  "license": "MIT",
  "author": {
    "name": "Open Design",
    "url": "https://github.com/nexu-io"
  },
  "homepage": "https://github.com/nexu-io/open-design/tree/main/plugins/_official/examples/html-ppt-presenter-mode-reveal",
  "tags": [
    "example",
    "first-party",
    "deck",
    "engineering",
    "web",
    "presenter-mode",
    "untitled",
    "speaker-notes",
    "presenter-view"
  ],
  "compat": {
    "agentSkills": [
      {
        "path": "./SKILL.md"
      }
    ]
  },
  "od": {
    "kind": "scenario",
    "taskKind": "new-generation",
    "mode": "deck",
    "scenario": "engineering",
    "surface": "web",
    "preview": {
      "type": "html",
      "entry": "./example.html"
    },
    "useCase": {
      "query": {
        "en": "Use this plugin for the following Chinese-language task: 用 html-ppt-presenter-mode 模板做一份带逐字稿的演讲 PPT。先确认：演讲主题、时长（每页 2-3 分钟）、目标听众。然后帮我每页写 150-300 字的口语化逐字稿（不是讲稿，是提示信号），按 S 能打开 presenter 弹窗。",
        "zh-CN": "用 html-ppt-presenter-mode 模板做一份带逐字稿的演讲 PPT。先确认：演讲主题、时长（每页 2-3 分钟）、目标听众。然后帮我每页写 150-300 字的口语化逐字稿（不是讲稿，是提示信号），按 S 能打开 presenter 弹窗。"
      },
      "exampleOutputs": [
        {
          "path": "./example.html",
          "title": "Html Ppt Presenter Mode Reveal"
        }
      ]
    },
    "context": {
      "skills": [
        {
          "path": "./SKILL.md"
        }
      ],
      "assets": [
        "./example.html"
      ]
    },
    "pipeline": {
      "stages": [
        {
          "id": "generate",
          "atoms": [
            "file-write",
            "live-artifact"
          ]
        }
      ]
    },
    "capabilities": [
      "prompt:inject",
      "fs:write"
    ]
  }
}
